{
  "schema_version": "mika.repo-handoff-evidence.v2",
  "generated_at": "2026-10-13T10:36:46.828499+00:00",
  "analysis_baseline": {
    "repository_id": "R-1",
    "ref": "codex/implement-cloudflare-restart",
    "commit_sha": "09d772e0f05b0ce175777868bc07d8af53a09204"
  },
  "packet_sha256": "74ceaa8f979284c8ac9bfee9c25c0daa47b593cc988a261e29a547e103bf7f52",
  "artifacts": [
    {
      "path": "AGENTS.md",
      "treatment": "UPDATE",
      "authority": "CANONICAL",
      "evidence_ids": [
        "EV-01",
        "EV-02"
      ],
      "owner_decision_ids": [
        "D-01",
        "D-02",
        "D-03",
        "D-04",
        "D-05"
      ],
      "freshness_trigger": "Material source, deployment, owner intent or verification change; refresh binding before new claims.",
      "roles": [
        "agent_entry"
      ]
    },
    {
      "path": "CODEX_START.md",
      "treatment": "UPDATE",
      "authority": "CANONICAL",
      "evidence_ids": [
        "EV-01",
        "EV-02"
      ],
      "owner_decision_ids": [
        "D-01",
        "D-02",
        "D-03",
        "D-04",
        "D-05"
      ],
      "freshness_trigger": "Material source, deployment, owner intent or verification change; refresh binding before new claims.",
      "roles": [
        "start_here"
      ]
    },
    {
      "path": "docs/ai-dev/MISSION.md",
      "treatment": "CREATE",
      "authority": "CANONICAL",
      "evidence_ids": [
        "EV-01",
        "EV-02"
      ],
      "owner_decision_ids": [
        "D-01",
        "D-02",
        "D-03",
        "D-04",
        "D-05"
      ],
      "freshness_trigger": "Material source, deployment, owner intent or verification change; refresh binding before new claims.",
      "roles": [
        "mission",
        "owner_decisions"
      ]
    },
    {
      "path": "docs/ai-dev/PROJECT_CONTEXT.md",
      "treatment": "CREATE",
      "authority": "GENERATED_VIEW",
      "evidence_ids": [
        "EV-01",
        "EV-02"
      ],
      "owner_decision_ids": [
        "D-01",
        "D-02",
        "D-03",
        "D-04",
        "D-05"
      ],
      "freshness_trigger": "Material source, deployment, owner intent or verification change; refresh binding before new claims.",
      "roles": [
        "current_state",
        "architecture_runtime",
        "run_deploy_operations",
        "production_baseline"
      ]
    },
    {
      "path": "PRODUCT.md",
      "treatment": "LINK",
      "authority": "CANONICAL",
      "evidence_ids": [
        "EV-01",
        "EV-02"
      ],
      "owner_decision_ids": [
        "D-03"
      ],
      "freshness_trigger": "Material source, deployment, owner intent or verification change; refresh binding before new claims.",
      "roles": [
        "product_truth"
      ]
    },
    {
      "path": "docs/ai-dev/REPOSITORY_INTELLIGENCE.md",
      "treatment": "CREATE",
      "authority": "GENERATED_VIEW",
      "evidence_ids": [
        "EV-01",
        "EV-02"
      ],
      "owner_decision_ids": [
        "D-01",
        "D-02",
        "D-03",
        "D-04",
        "D-05"
      ],
      "freshness_trigger": "Material source, deployment, owner intent or verification change; refresh binding before new claims.",
      "roles": [
        "feature_inventory",
        "intelligence_markdown"
      ]
    },
    {
      "path": "docs/ai-dev/repository-intelligence.json",
      "treatment": "CREATE",
      "authority": "GENERATED_VIEW",
      "evidence_ids": [
        "EV-01",
        "EV-02"
      ],
      "owner_decision_ids": [
        "D-01",
        "D-02",
        "D-03",
        "D-04",
        "D-05"
      ],
      "freshness_trigger": "Material source, deployment, owner intent or verification change; refresh binding before new claims.",
      "roles": [
        "intelligence_json"
      ]
    },
    {
      "path": "docs/ai-dev/EXECUTION_PLAN.md",
      "treatment": "CREATE",
      "authority": "CANONICAL",
      "evidence_ids": [
        "EV-01",
        "EV-02"
      ],
      "owner_decision_ids": [
        "D-01",
        "D-02",
        "D-03",
        "D-04",
        "D-05"
      ],
      "freshness_trigger": "Material source, deployment, owner intent or verification change; refresh binding before new claims.",
      "roles": [
        "quality_risks",
        "execution_plan"
      ]
    },
    {
      "path": "docs/ai-dev/EVIDENCE.json",
      "treatment": "CREATE",
      "authority": "SUPPORTING",
      "evidence_ids": [
        "EV-01",
        "EV-02"
      ],
      "owner_decision_ids": [
        "D-01",
        "D-02",
        "D-03",
        "D-04",
        "D-05"
      ],
      "freshness_trigger": "Material source, deployment, owner intent or verification change; refresh binding before new claims.",
      "roles": [
        "verification_ledger"
      ]
    },
    {
      "path": "docs/ai-dev/EVIDENCE_MANIFEST.json",
      "treatment": "CREATE",
      "authority": "GENERATED_VIEW",
      "evidence_ids": [
        "EV-01",
        "EV-02"
      ],
      "owner_decision_ids": [
        "D-01",
        "D-02",
        "D-03",
        "D-04",
        "D-05"
      ],
      "freshness_trigger": "Material source, deployment, owner intent or verification change; refresh binding before new claims.",
      "roles": [
        "evidence_manifest"
      ]
    }
  ]
}
